{
  "schema_version": 1,
  "id": "R20",
  "clase": "repo",
  "particion": "desarrollo",
  "titulo": "SemVer: Display y max",
  "etiqueta": "semver-display-max",
  "origen": "mejora_especificada",
  "entrada": {
    "enunciado": "visible/R20/enunciado.md",
    "archivos": []
  },
  "resultado_observable": "La suite del crate, con la prueba reservada incluida, termina con código 0.",
  "comprobador": {
    "argv": [
      "soso-improve",
      "verificar",
      "repo",
      "--caso",
      "R20",
      "--arbol",
      "{arbol}"
    ],
    "timeout_s": 900
  },
  "recursos": {
    "cpu": 4,
    "memoria_mb": 4096,
    "red": false,
    "escritura": [
      "{arbol}"
    ],
    "herramientas": [
      "cargo",
      "rustc",
      "git"
    ]
  },
  "reservado": [
    "reservado/R20/aceptacion.rs",
    "reservado/R20/referencia.patch"
  ],
  "hashes_entrada": {
    "visible/R20/enunciado.md": "0daf9249150cabdcb159aa9372fab8aba540838251137c1a5f8fd9a05ffd48b1"
  },
  "base": {
    "commit": "6f558f072bcc3ce46763994c377f1161d6411698",
    "rama": "main",
    "captura": "target/self-improvement/base-T02"
  },
  "rutas_editables": [
    "crates/soso-update-core/src/semver.rs"
  ],
  "aceptacion": {
    "descripcion": "SemVer: Display y max",
    "argv": [
      "cargo",
      "test",
      "-q",
      "-p",
      "soso-update-core",
      "--features",
      "std"
    ],
    "prueba_reservada": "reservado/R20/aceptacion.rs",
    "destino_prueba": "crates/soso-update-core/tests/aceptacion_R20.rs",
    "referencia": "reservado/R20/referencia.patch"
  }
}
