{
  "schema_version": 1,
  "id": "R29",
  "clase": "repo",
  "particion": "desarrollo",
  "titulo": "TierManager::promote no expulsa de más ni deja el gestor vacío",
  "etiqueta": "tier-promote",
  "origen": "mejora_especificada",
  "entrada": {
    "enunciado": "visible/R29/enunciado.md",
    "archivos": []
  },
  "resultado_observable": "La suite del crate, con la prueba reservada incluida, termina con código 0.",
  "comprobador": {
    "argv": [
      "soso-improve",
      "verificar",
      "repo",
      "--caso",
      "R29",
      "--arbol",
      "{arbol}"
    ],
    "timeout_s": 900
  },
  "recursos": {
    "cpu": 4,
    "memoria_mb": 4096,
    "red": false,
    "escritura": [
      "{arbol}"
    ],
    "herramientas": [
      "cargo",
      "rustc",
      "git"
    ]
  },
  "reservado": [
    "reservado/R29/aceptacion.rs",
    "reservado/R29/referencia.patch"
  ],
  "hashes_entrada": {
    "visible/R29/enunciado.md": "349cc7b98c2b65f3ae3fba53f9cd6222b3699fba1f9b0aa5d6affeb52b0f9f0e"
  },
  "base": {
    "commit": "6f558f072bcc3ce46763994c377f1161d6411698",
    "rama": "main",
    "captura": "target/self-improvement/base-T02"
  },
  "rutas_editables": [
    "crates/soso-llm-core/src/tier.rs"
  ],
  "aceptacion": {
    "descripcion": "TierManager::promote no expulsa de más ni deja el gestor vacío",
    "argv": [
      "cargo",
      "test",
      "-q",
      "-p",
      "soso-llm-core",
      "--features",
      "std"
    ],
    "prueba_reservada": "reservado/R29/aceptacion.rs",
    "destino_prueba": "crates/soso-llm-core/tests/aceptacion_R29.rs",
    "referencia": "reservado/R29/referencia.patch"
  }
}
