{
  "schema_version": 1,
  "id": "R10",
  "clase": "repo",
  "particion": "desarrollo",
  "titulo": "Span::contains y Span::overlaps con semántica semiabierta",
  "etiqueta": "tramos-solape",
  "origen": "mejora_especificada",
  "entrada": {
    "enunciado": "visible/R10/enunciado.md",
    "archivos": []
  },
  "resultado_observable": "La suite del crate, con la prueba reservada incluida, termina con código 0.",
  "comprobador": {
    "argv": [
      "soso-improve",
      "verificar",
      "repo",
      "--caso",
      "R10",
      "--arbol",
      "{arbol}"
    ],
    "timeout_s": 900
  },
  "recursos": {
    "cpu": 4,
    "memoria_mb": 4096,
    "red": false,
    "escritura": [
      "{arbol}"
    ],
    "herramientas": [
      "cargo",
      "rustc",
      "git"
    ]
  },
  "reservado": [
    "reservado/R10/aceptacion.rs",
    "reservado/R10/referencia.patch"
  ],
  "hashes_entrada": {
    "visible/R10/enunciado.md": "d1ba8aa369a8a92547857e710cd3742532eaf31fd236e8f9101018850a819801"
  },
  "base": {
    "commit": "6f558f072bcc3ce46763994c377f1161d6411698",
    "rama": "main",
    "captura": "target/self-improvement/base-T02"
  },
  "rutas_editables": [
    "crates/soso-update-core/src/plan.rs"
  ],
  "aceptacion": {
    "descripcion": "Pasa la suite de soso-update-core con la prueba reservada: `contains` y `overlaps` respetan el intervalo semiabierto [start, end).",
    "argv": [
      "cargo",
      "test",
      "-q",
      "-p",
      "soso-update-core",
      "--features",
      "std"
    ],
    "prueba_reservada": "reservado/R10/aceptacion.rs",
    "destino_prueba": "crates/soso-update-core/tests/aceptacion_R10.rs",
    "referencia": "reservado/R10/referencia.patch"
  }
}
