{
  "schema_version": 1,
  "id": "R13",
  "clase": "repo",
  "particion": "desarrollo",
  "titulo": "PartGeom: tramo invertido de 0 sectores, contains y overlaps",
  "etiqueta": "geometria-particion",
  "origen": "mejora_especificada",
  "entrada": {
    "enunciado": "visible/R13/enunciado.md",
    "archivos": []
  },
  "resultado_observable": "La suite del crate, con la prueba reservada incluida, termina con código 0.",
  "comprobador": {
    "argv": [
      "soso-improve",
      "verificar",
      "repo",
      "--caso",
      "R13",
      "--arbol",
      "{arbol}"
    ],
    "timeout_s": 900
  },
  "recursos": {
    "cpu": 4,
    "memoria_mb": 4096,
    "red": false,
    "escritura": [
      "{arbol}"
    ],
    "herramientas": [
      "cargo",
      "rustc",
      "git"
    ]
  },
  "reservado": [
    "reservado/R13/aceptacion.rs",
    "reservado/R13/referencia.patch"
  ],
  "hashes_entrada": {
    "visible/R13/enunciado.md": "99c9d42e69cdda59a1ca6047bf16ba0b3c72f4c3a165d5264ddc5b74f6a780b4"
  },
  "base": {
    "commit": "6f558f072bcc3ce46763994c377f1161d6411698",
    "rama": "main",
    "captura": "target/self-improvement/base-T02"
  },
  "rutas_editables": [
    "crates/soso-resize-core/src/lib.rs"
  ],
  "aceptacion": {
    "descripcion": "PartGeom: tramo invertido de 0 sectores, contains y overlaps",
    "argv": [
      "cargo",
      "test",
      "-q",
      "-p",
      "soso-resize-core"
    ],
    "prueba_reservada": "reservado/R13/aceptacion.rs",
    "destino_prueba": "crates/soso-resize-core/tests/aceptacion_R13.rs",
    "referencia": "reservado/R13/referencia.patch"
  }
}
