{
  "schema_version": 1,
  "id": "R06",
  "clase": "repo",
  "particion": "desarrollo",
  "titulo": "header_values devuelve todas las cabeceras repetidas",
  "etiqueta": "cabeceras-repetidas",
  "origen": "mejora_especificada",
  "entrada": {
    "enunciado": "visible/R06/enunciado.md",
    "archivos": []
  },
  "resultado_observable": "La suite del crate, con la prueba reservada incluida, termina con código 0.",
  "comprobador": {
    "argv": [
      "soso-improve",
      "verificar",
      "repo",
      "--caso",
      "R06",
      "--arbol",
      "{arbol}"
    ],
    "timeout_s": 900
  },
  "recursos": {
    "cpu": 4,
    "memoria_mb": 4096,
    "red": false,
    "escritura": [
      "{arbol}"
    ],
    "herramientas": [
      "cargo",
      "rustc",
      "git"
    ]
  },
  "reservado": [
    "reservado/R06/aceptacion.rs",
    "reservado/R06/referencia.patch"
  ],
  "hashes_entrada": {
    "visible/R06/enunciado.md": "6af1e2e45d71151bc038ab372d6449502f8e54f407e1dda86e51060b1b316e05"
  },
  "base": {
    "commit": "6f558f072bcc3ce46763994c377f1161d6411698",
    "rama": "main",
    "captura": "target/self-improvement/base-T02"
  },
  "rutas_editables": [
    "crates/soso-http/src/lib.rs"
  ],
  "aceptacion": {
    "descripcion": "Pasa la suite de soso-http con la prueba reservada: `header_values` devuelve todos los valores, sin distinguir mayúsculas y en orden.",
    "argv": [
      "cargo",
      "test",
      "-q",
      "-p",
      "soso-http"
    ],
    "prueba_reservada": "reservado/R06/aceptacion.rs",
    "destino_prueba": "crates/soso-http/tests/aceptacion_R06.rs",
    "referencia": "reservado/R06/referencia.patch"
  }
}
