{
  "schema_version": 1,
  "id": "R27",
  "clase": "repo",
  "particion": "desarrollo",
  "titulo": "psk_from_passphrase valida passphrase y SSID y acepta la PMK en hex",
  "etiqueta": "psk-validacion",
  "origen": "mejora_especificada",
  "entrada": {
    "enunciado": "visible/R27/enunciado.md",
    "archivos": []
  },
  "resultado_observable": "La suite del crate, con la prueba reservada incluida, termina con código 0.",
  "comprobador": {
    "argv": [
      "soso-improve",
      "verificar",
      "repo",
      "--caso",
      "R27",
      "--arbol",
      "{arbol}"
    ],
    "timeout_s": 900
  },
  "recursos": {
    "cpu": 4,
    "memoria_mb": 4096,
    "red": false,
    "escritura": [
      "{arbol}"
    ],
    "herramientas": [
      "cargo",
      "rustc",
      "git"
    ]
  },
  "reservado": [
    "reservado/R27/aceptacion.rs",
    "reservado/R27/referencia.patch"
  ],
  "hashes_entrada": {
    "visible/R27/enunciado.md": "59354d06931e3b04fbb6b4e8cb166cec38246ebaf0f2ddd95ee22bec7e1ffb40"
  },
  "base": {
    "commit": "6f558f072bcc3ce46763994c377f1161d6411698",
    "rama": "main",
    "captura": "target/self-improvement/base-T02"
  },
  "rutas_editables": [
    "crates/soso-wpa2/src/crypto.rs"
  ],
  "aceptacion": {
    "descripcion": "psk_from_passphrase valida passphrase y SSID y acepta la PMK en hex",
    "argv": [
      "cargo",
      "test",
      "-q",
      "-p",
      "soso-wpa2"
    ],
    "prueba_reservada": "reservado/R27/aceptacion.rs",
    "destino_prueba": "crates/soso-wpa2/tests/aceptacion_R27.rs",
    "referencia": "reservado/R27/referencia.patch"
  }
}
